{
  "schema": "pids-nexus/domain-work-design/v1",
  "domain": "admin",
  "label": "行政 ADMIN",
  "level": "L3",
  "north_star": "资产利用、采购节约与服务 SLA",
  "contributes_to": [
    "KR-REV",
    "KR-CONTROL"
  ],
  "modules": [
    {
      "id": "procurement",
      "name": "采购与供应商管理",
      "outcome": "用三家比价、预算和入库闭环控制成本",
      "benchmark_refs": [
        "ISO-55000",
        "COSO-ERM"
      ],
      "items": [
        {
          "id": "admin-vendor-price",
          "name": "供应商比价",
          "outcome": "报价、最低价、预算和选择理由一致",
          "owner_role": "采购负责人",
          "frequency": "按采购申请",
          "workflow": {
            "id": "admin.vendor-price@1.0.0",
            "description": "供应商比价报告（三家原则）",
            "kind": "report",
            "skill": "purchase-compare",
            "trigger": {
              "type": "command",
              "expr": "vendor-price"
            },
            "nodes": [
              {
                "id": "n1",
                "type": "skill",
                "ref": "purchase-compare"
              },
              {
                "id": "n2",
                "type": "tool",
                "ref": "cap.excel.panel.write"
              },
              {
                "id": "n3",
                "type": "audit",
                "record": "供应商比价报告（三家原则）：数据版本 + 产物哈希"
              }
            ],
            "deliverable": {
              "file": "vendor-price-<ts>.json",
              "format": "json",
              "fields": [
                "item",
                "quotes",
                "lowest",
                "chosen"
              ],
              "acceptance": "不足三家须说明理由"
            },
            "approval": null
          },
          "stages": [
            {
              "owner_role": "采购负责人",
              "entry_criteria": "上游阶段通过且实例 revision、策略版本和数据版本可读取",
              "input_contract_ref": "manifests/workflow-contracts/admin.json#admin.vendor-price@1.0.0/stage_contracts/intake/input",
              "output_contract_ref": "manifests/workflow-contracts/admin.json#admin.vendor-price@1.0.0/stage_contracts/intake/output",
              "evidence": [
                "source_refs",
                "file_hashes",
                "data_version"
              ],
              "timeout_seconds": 300,
              "retry_policy": {
                "max_attempts": 1,
                "backoff": "none"
              },
              "idempotency_key": "${instance_id}:${stage_id}:${revision}",
              "ui_help": "按字段说明填写；来源必须引用具体表、文件或上游实例。",
              "failure_severity": "blocking",
              "id": "intake",
              "type": "data_intake",
              "name": "业务输入与资料接收",
              "inputs": [
                "item",
                "quotes",
                "lowest",
                "chosen"
              ],
              "outputs": [
                "validated_input_payload",
                "source_refs",
                "file_hashes"
              ],
              "standard": "必填字段 item、quotes、lowest、chosen 完整；来源、上传文件、数据版本和文件哈希可追溯。",
              "gate": "required_fields_and_upload_safety",
              "on_fail": "retain_draft_and_request_user_input",
              "rule_refs": [
                "admin-vendor-price-INPUT-REQUIRED",
                "admin-vendor-price-SOURCE-TRACEABLE"
              ]
            },
            {
              "owner_role": "采购负责人",
              "entry_criteria": "上游阶段通过且实例 revision、策略版本和数据版本可读取",
              "input_contract_ref": "manifests/workflow-contracts/admin.json#admin.vendor-price@1.0.0/stage_contracts/validate/input",
              "output_contract_ref": "manifests/workflow-contracts/admin.json#admin.vendor-price@1.0.0/stage_contracts/validate/output",
              "evidence": [
                "source_refs",
                "file_hashes",
                "data_version"
              ],
              "timeout_seconds": 300,
              "retry_policy": {
                "max_attempts": 1,
                "backoff": "none"
              },
              "idempotency_key": "${instance_id}:${stage_id}:${revision}",
              "ui_help": "按字段说明填写；来源必须引用具体表、文件或上游实例。",
              "failure_severity": "blocking",
              "id": "validate",
              "type": "rule_gate",
              "name": "结构与业务规则校验",
              "inputs": [
                "validated_input_payload",
                "assets.csv",
                "purchases.csv"
              ],
              "outputs": [
                "validation_report",
                "normalized_payload"
              ],
              "standard": "不足三家须说明理由；字段类型、枚举、区间、单位、主外键和血缘必须按 TypeDict 校验。；脱敏字段 seal_record、procurement_price 只能以掩码或区间形式进入后续阶段。",
              "gate": "typedict_and_domain_rules",
              "on_fail": "field_level_error_without_write",
              "rule_refs": [
                "admin-vendor-price-DOMAIN-RULE",
                "admin-vendor-price-TYPEDICT"
              ],
              "benchmark_refs": []
            },
            {
              "owner_role": "采购负责人",
              "entry_criteria": "上游阶段通过且实例 revision、策略版本和数据版本可读取",
              "input_contract_ref": "manifests/workflow-contracts/admin.json#admin.vendor-price@1.0.0/stage_contracts/llm/input",
              "output_contract_ref": "manifests/workflow-contracts/admin.json#admin.vendor-price@1.0.0/stage_contracts/llm/output",
              "evidence": [
                "source_refs",
                "file_hashes",
                "data_version"
              ],
              "timeout_seconds": 240000,
              "retry_policy": {
                "max_attempts": 1,
                "backoff": "manual_after_credentials_restore"
              },
              "idempotency_key": "${instance_id}:${stage_id}:${revision}",
              "ui_help": "模型失败会保留草稿并进入 blocked_model；恢复凭据后可从断点继续。",
              "failure_severity": "blocking",
              "id": "llm",
              "type": "llm_task",
              "name": "LLM 结构化分析与生成",
              "inputs": [
                "normalized_payload",
                "skill_and_policy_version"
              ],
              "outputs": [
                "summary",
                "findings",
                "recommendations",
                "confidence",
                "evidence_refs"
              ],
              "standard": "使用技能 purchase-compare 和当前策略版本；输出必须符合 JSON Schema，结论逐项引用 evidence_refs，confidence 为 0-1，未知字段、无证据结论和 PII 一律拒绝。",
              "gate": "schema_citation_pii_model_availability",
              "on_fail": "blocked_model_or_quality_retry",
              "rule_refs": [
                "admin-vendor-price-LLM-SCHEMA",
                "admin-vendor-price-LLM-EVIDENCE",
                "admin-vendor-price-LLM-PII"
              ],
              "benchmark_refs": []
            },
            {
              "owner_role": "采购负责人",
              "entry_criteria": "上游阶段通过且实例 revision、策略版本和数据版本可读取",
              "input_contract_ref": "manifests/workflow-contracts/admin.json#admin.vendor-price@1.0.0/stage_contracts/quality/input",
              "output_contract_ref": "manifests/workflow-contracts/admin.json#admin.vendor-price@1.0.0/stage_contracts/quality/output",
              "evidence": [
                "source_refs",
                "file_hashes",
                "data_version"
              ],
              "timeout_seconds": 300,
              "retry_policy": {
                "max_attempts": 1,
                "backoff": "none"
              },
              "idempotency_key": "${instance_id}:${stage_id}:${revision}",
              "ui_help": "按字段说明填写；来源必须引用具体表、文件或上游实例。",
              "failure_severity": "blocking",
              "id": "quality",
              "type": "quality_gate",
              "name": "质量、证据与一致性复核",
              "inputs": [
                "llm_result",
                "source_refs",
                "business_metric_definitions"
              ],
              "outputs": [
                "quality_score",
                "approved_analysis",
                "redaction_log"
              ],
              "standard": "业务验收：不足三家须说明理由；证据引用可解析，金额、数量、比例和阶段人数守恒，结论与指标定义不冲突。",
              "gate": "Great-Expectations-style_assertions",
              "on_fail": "retry_then_manual_review",
              "rule_refs": [
                "admin-vendor-price-QUALITY-EVIDENCE",
                "admin-vendor-price-QUALITY-CONSISTENCY"
              ],
              "benchmark_refs": [
                "GREATEXPECTATIONS",
                "OPENLINEAGE153"
              ]
            },
            {
              "owner_role": "采购负责人",
              "entry_criteria": "上游阶段通过且实例 revision、策略版本和数据版本可读取",
              "input_contract_ref": "manifests/workflow-contracts/admin.json#admin.vendor-price@1.0.0/stage_contracts/approval/input",
              "output_contract_ref": "manifests/workflow-contracts/admin.json#admin.vendor-price@1.0.0/stage_contracts/approval/output",
              "evidence": [
                "source_refs",
                "file_hashes",
                "data_version"
              ],
              "timeout_seconds": 300,
              "retry_policy": {
                "max_attempts": 1,
                "backoff": "none"
              },
              "idempotency_key": "${instance_id}:${stage_id}:${revision}",
              "ui_help": "本流程不生成正式审批件；但外部发送、生效或高风险动作仍会被门禁阻断。",
              "failure_severity": "blocking",
              "id": "approval",
              "type": "no_human_approval",
              "name": "免人工审批声明",
              "inputs": [
                "approved_analysis",
                "quality_score"
              ],
              "outputs": [
                "approval_policy_evaluation"
              ],
              "standard": "仅允许无对外、无生效、无高风险个体数据的流程免审批；策略评估必须留痕，出现对外或不可逆动作时升级人工审批。",
              "gate": "no_external_or_irreversible_action",
              "on_fail": "escalate_to_human",
              "rule_refs": [